Event,описание,Количество параметров,Параметр,Описание параметра,Уже есть в статисте?
IW_Auth_Success,Успешная авторизация,2,bank,Название банка,
IW_Auth_Success,Успешная авторизация,2,from,из какого продукта/сервиса перешли в IW,
IW_Conditions_Shown,показ экрана с условиями использования,0,,,
IW_Login_Shown,показ экрана с логином,3,bank,название банка,
IW_Login_Shown,показ экрана с логином,3,from,из какого продукта/сервиса перешли в IW,
IW_Login_Shown,показ экрана с логином,3,status,как попал на авторизацию,
IW_SMS_Close_Click,нажатие на закрыть или крестик на экране с смс,0,,,
Origination_Access_Account_Shown,"При показе экрана ""Доступ к счету""",1,id,,
Origination_Added_Employee,При успешном добавлении сотрудника. Передаем вид доступа к счету для этого сотрудника,2,accessType,,
Origination_Added_Employee,При успешном добавлении сотрудника. Передаем вид доступа к счету для этого сотрудника,2,id,,
Origination_Added_Employee_Error,"При выскакивании попапа ""Выберете хотя бы один из способов доступа к счету""",1,id,,
Origination_Already_User,"При показе экрана ""Проверьте номер""",0,,,
Origination_Application_Main_Error,"При показе ошибки загрузки экрана статуса заявки ""Не смогли загрузить статус заявки""",2,applStatus,,
Origination_Application_Main_Error,"При показе ошибки загрузки экрана статуса заявки ""Не смогли загрузить статус заявки""",2,id,,
Origination_Application_Main_Shown,При успешной загрузке экрана статуса заявки,2,applStatus,,
Origination_Application_Main_Shown,При успешной загрузке экрана статуса заявки,2,id,,
Origination_Company_Info_Shown,"При показе экрана ""Сведения о вашей компании""",0,,,
Origination_Data_Processing_Done,"При показе экрана ""Готово! Перейти к настройке доступа к счету..""",1,id,,
Origination_Data_Processing_Shown,"При показе ""Отправляем заявки"" (первого экрана из карусели)",1,id,,
Origination_Deleted_Employee,"При тапе на кнопку ""удалить сотрудника""",1,id,,
Origination_Denied_Shown,При показе любого из экранов отказа в открытии счета,2,deniedReason,,
Origination_Denied_Shown,При показе любого из экранов отказа в открытии счета,2,id,,
Origination_Doc_Upload_Empty_Document_Error,"При показе ошибки ""Загрузите все документы перед отправкой..."" (при тапе на кнопку ""Отправить в банк"", когда загружены не все документы)",1,id,,
Origination_Doc_Upload_List_Shown,При показе экрана списка файлов по конкретному документов,2,id,,
Origination_Doc_Upload_List_Shown,При показе экрана списка файлов по конкретному документов,2,type,,
Origination_Doc_Upload_Loading_Type,"При тапе на одну из кнопок типа загрузки ""Из файлового менеджера"" и ""Снять или выбрать фото""",2,id,,
Origination_Doc_Upload_Loading_Type,"При тапе на одну из кнопок типа загрузки ""Из файлового менеджера"" и ""Снять или выбрать фото""",2,method,,
Origination_Doc_Upload_Main_Shown,При показе основного экрана загрузки документов,1,id,,
Origination_Doc_Upload_Sent,При успешной отправке документов (финальный экран),1,id,,
Origination_Employee_Shown,При показе экрана Сотрудники (список добавленных сотрудников),1,id,,
Origination_File_Delete,При успешном удалении файлов (успешно отработал метод),1,id,,
Origination_File_Upload,При успешной загрузке файла (успешно отработал метод бэка),2,id,,
Origination_File_Upload,При успешной загрузке файла (успешно отработал метод бэка),2,type,,
Origination_File_Upload_Error,При показе ошибки метода загрузки файла,2,id,,
Origination_File_Upload_Error,При показе ошибки метода загрузки файла,2,type,,
Origination_Foreign_Number,"При показе экрана ""Мы не знакомы""",0,,,
Origination_Meeting_Add_To_Calendar,"При тапе на кнопку ""Добавить в календарь""",1,id,,
Origination_Meeting_Addresses_Shown,"При отображении экрана ""Выбор адреса""",1,id,,
Origination_Meeting_Details_Shown,"При показе экрана ""Встреча. Детали встречи""",1,id,,
Origination_Meeting_Done,При успешном назначении встречи (финальный оффер),1,id,,
Origination_Meeting_Gray_Zone_Error,"При отображении плашки ""Не осуществляем доставку по указанному адресу""",1,id,,
Origination_Meeting_Gray_Zone_Сhoice,"При тапе на одну из кнопок выбрать на плашке ""Не осуществляем доставку по указанному адресу""",2,button,,
Origination_Meeting_Gray_Zone_Сhoice,"При тапе на одну из кнопок выбрать на плашке ""Не осуществляем доставку по указанному адресу""",2,id,,
Origination_Meeting_Members_Shown,"При показе экрана ""Встреча. Участники встречи""",1,id,,
Origination_Meeting_New_Address_Type,При изменении типа адреса (только у ООО). Передаем выбранный адрес,2,id,,
Origination_Meeting_New_Address_Type,При изменении типа адреса (только у ООО). Передаем выбранный адрес,2,type,,
Origination_Photo_Passport_Done,При успешном скане паспорта (успешным считаем автозаполнение хотя бы одно поля ПД),2,id,,
Origination_Photo_Passport_Done,При успешном скане паспорта (успешным считаем автозаполнение хотя бы одно поля ПД),2,who,,
Origination_Prepare_Passport_Shown,"При показе заглушки ""Приготовьте паспорт""",1,id,,
Origination_Print_Passport_Info_Error,"При ошибке валидации при вводе данных паспорта вручную. Передаем поля, которые не прошли валидацию",2,fieldType,,
Origination_Print_Passport_Info_Error,"При ошибке валидации при вводе данных паспорта вручную. Передаем поля, которые не прошли валидацию",2,id,,
Origination_Print_Passport_Shown,При показе экрана Паспортных данных,2,id,,
Origination_Print_Passport_Shown,При показе экрана Паспортных данных,2,who,,
Origination_Scan_Passport,"При тапе клиента на кнопку ""Отсканировать паспорт"" (т.к. не можем определять отрылась сканировалка паспорта или нет)",2,id,,
Origination_Scan_Passport,"При тапе клиента на кнопку ""Отсканировать паспорт"" (т.к. не можем определять отрылась сканировалка паспорта или нет)",2,who,,
Origination_Signing_Document_Done,При успешном подписании документа,3,document,,
Origination_Signing_Document_Done,При успешном подписании документа,3,id,,
Origination_Signing_Document_Done,При успешном подписании документа,3,type,,
Origination_Signing_Document_Shown,При показе pdf конкретного документа,3,document,,
Origination_Signing_Document_Shown,При показе pdf конкретного документа,3,id,,
Origination_Signing_Document_Shown,При показе pdf конкретного документа,3,type,,
Origination_Signing_Offer_Shown,При показе оффера Подпишите документы / Подпиши конкретный документ,2,documents,,
Origination_Signing_Offer_Shown,При показе оффера Подпишите документы / Подпиши конкретный документ,2,id,,
Origination_Signing_Sign,При тапе на кнопку Подписать (т.к. не можем отправить событие выше),1,id,,
Origination_Tax_System_Error_Shown,При ошибке на экране системы налогообложения,1,errorReason,,
Origination_Tax_System_Shown,"При показе экрана ""Ваша система налогообложения""",0,,,
Origination_Welcome_To_TB_Shown,"При показе экрана ""Добро пожаловать в Тинькофф Бизнес""",1,id,,
Story_Action,При любом действии внутри истории (переход по диплинку или вебвью),7,action_kind,,
Story_Action,При любом действии внутри истории (переход по диплинку или вебвью),7,actionType,,
Story_Action,При любом действии внутри истории (переход по диплинку или вебвью),7,block_guid,,
Story_Action,При любом действии внутри истории (переход по диплинку или вебвью),7,blockGuid,,
Story_Action,При любом действии внутри истории (переход по диплинку или вебвью),7,step,,
Story_Action,При любом действии внутри истории (переход по диплинку или вебвью),7,storyId,,
Story_Action,При любом действии внутри истории (переход по диплинку или вебвью),7,text,,
Story_Closed,При закрытии истории,4,name,,
Story_Closed,При закрытии истории,4,step,,
Story_Closed,При закрытии истории,4,storyId,,
Story_Closed,При закрытии истории,4,type,,
Story_Disliked,При дизлайке истории,2,name,,
Story_Disliked,При дизлайке истории,2,storyId,,
Story_Last_Step_Shown,При показе последнего шага истории,2,stepCount,,
Story_Last_Step_Shown,При показе последнего шага истории,2,storyId,,
Story_Liked,При лайке истории,2,name,,
Story_Liked,При лайке истории,2,storyId,,
Story_Saved,При сохранении истории,3,name,,
Story_Saved,При сохранении истории,3,step,,
Story_Saved,При сохранении истории,3,storyId,,
Story_Shared,При шаринге истории,5,app_name,,
Story_Shared,При шаринге истории,5,appName,"приложение, в которое пошарили",
Story_Shared,При шаринге истории,5,name,,
Story_Shared,При шаринге истории,5,step,,
Story_Shared,При шаринге истории,5,storyId,,
Story_Shown,При показе истории,14,category,,
Story_Shown,При показе истории,14,deeplink_source,,
Story_Shown,При показе истории,14,first,,
Story_Shown,При показе истории,14,name,,
Story_Shown,При показе истории,14,popup,,
Story_Shown,При показе истории,14,screen,,
Story_Shown,При показе истории,14,serial_number,,
Story_Shown,При показе истории,14,shownBy,,
Story_Shown,При показе истории,14,sound,,
Story_Shown,При показе истории,14,step,,
Story_Shown,При показе истории,14,stepCount,,
Story_Shown,При показе истории,14,storyId,,
Story_Shown,При показе истории,14,style,,
Story_Shown,При показе истории,14,videoPreview,,
Story_Sound_Action,При включении/выключении звука в истории,3,action,,
Story_Sound_Action,При включении/выключении звука в истории,3,storyId,,
Story_Sound_Action,При включении/выключении звука в истории,3,tap,,
Story_Step_Shown,При показе шага истории (кроме первого и последнего),3,step,,
Story_Step_Shown,При показе шага истории (кроме первого и последнего),3,storyId,,
Story_Step_Shown,При показе шага истории (кроме первого и последнего),3,storyName,,
Story_Unsaved,При удалении истории из сохраненных,3,name,,
Story_Unsaved,При удалении истории из сохраненных,3,step,,
Story_Unsaved,При удалении истории из сохраненных,3,storyId,,
Biometrics_Setup_Error,"При ошибке подключения входа по биометрии(допустим, не зашифровался пин-код)",1,errorType,,
Biometrics_Setup_Success,При успешном подключении входа по биометрическим данным,0,,,
Biometrics_Shown,"При показе экрана ""Подключение Touch ID"" или экрана ""Подключение Face ID""",1,type,,
Biometrics_Skipped,При нажатии на крестик на онбординге биометрии,0,,,
Card_Input_Change,При изменении номера карты в поле ввода. Слать только после успешного сканирования карты,0,,,
Card_Input_No_Card,"При показе попапа с номером телефона для звонка в КЦ, после нажатия на ""У меня нет карты""",1,screen,,
Card_Input_Scan,При успешном сканировании карты,2,authorization,,
Card_Input_Scan,При успешном сканировании карты,2,NFC,,
Card_Input_Shown,"При показе экрана ""Введите номер карты""",0,,,
Password_Create_Shown,"При показе экрана ""Задайте пароль""",0,,,
Password_Created,Пароль установлен,0,,,
Password_Input_Not_Me,"При выборе одного из вариантов на выпадающем списке при нажатии ""Я не ..."" на экране ""Здравствуйте, ...""",1,clickItem,,
Password_Input_Shown,"При показе экрана ""Здравствуйте, ...""",0,,,
Phone_Password_Conversion_Data,Событие отправляется после первого входа в приложение и после удаления/добавления пароля телефона. Необходимо только для IOS.,1,Password,"true - если пароль имеется на телефоне (пароль телефона, а не пароль в приложении), false - пароль не установлен на телефоне",
Pin_Current_Backend_Error,При ошибке с бекенда при введении текущего пин-кода,3,aim,,
Pin_Current_Backend_Error,При ошибке с бекенда при введении текущего пин-кода,3,authType,,
Pin_Current_Backend_Error,При ошибке с бекенда при введении текущего пин-кода,3,errorType,,
Pin_Current_Device_Error,При ошибке при всяких дешифровках текущего пин-кода,3,aim,,
Pin_Current_Device_Error,При ошибке при всяких дешифровках текущего пин-кода,3,authType,,
Pin_Current_Device_Error,При ошибке при всяких дешифровках текущего пин-кода,3,errorType,,
Pin_Current_Shown,При показе экрана с вводом текущего пин-кода,3,aim,,
Pin_Current_Shown,При показе экрана с вводом текущего пин-кода,3,app,,
Pin_Current_Shown,При показе экрана с вводом текущего пин-кода,3,thisapp,,
Pin_Current_Success,При успешном вводе текущего пин-кода,1,authType,,
Pin_Setup_Device_Error,При ошибке при всяких шифровках нового пин-кода,2,aim,,
Pin_Setup_Device_Error,При ошибке при всяких шифровках нового пин-кода,2,errorType,,
Pin_Setup_Shown,"При показе экрана ""Установка PIN-кода"" (как при первой установке, так и при смене пина)",1,aim,,
Pin_Setup_Success,"При успешном задании кода доступа на экране установки PIN-кода (как при первой установке, так и при смене пина)",1,aim,,
Security_Question_Input_Forget,"При тапе на надпись ""Я забыл ответ"" на экране ввода ответа на контрольный вопрос",1,clickOption,,
Security_Question_Input_Shown,При показе экрана ввода ответа на контрольный вопрос,0,,,
SmsCode_Shown,"При показе экрана ""Код подтверждения"" для подтверждения номера телефона только в момент авторизации или регистрации. Не срабатывает при добавлении функций с подтверждением по смс.",0,,,
Telephone_Input_Shown,"При показе экрана ""Введите номер телефона""",1,aim,,
BC_All_List_Shown,,0,,,
BC_CardPage_Scroll,,0,,,
BC_CardPage_Search,,0,,,
BC_CardRename_Btn,,1,Button,,
BC_CardRename_Save,,1,FromScreen,,
BC_Limits_Change_Shown,,1,limitsType,,
BC_NewLimits_Cash,,1,Limit,,
BC_NewLimits_Merch,,2,Limit,,
BC_NewLimits_Merch,,2,LimitScreen,,
BC_Offer_Currency_Card_Set,,0,,,
BC_Offer_Currency_Card_Shown,,0,,,
BK_Action_Set,БК. Общее. При нажатии на любое действие,3,ButtonType,,
BK_Action_Set,БК. Общее. При нажатии на любое действие,3,pinFlg,,
BK_Action_Set,БК. Общее. При нажатии на любое действие,3,VirtualFlg,,
BK_Card_Actions_Shown,,1,pinFlg,,
BK_Card_Shown,,8,actionsBtns,,
BK_Card_Shown,,8,ownedByCurrentUser,,
BK_Card_Shown,,8,pinFlg,,
BK_Card_Shown,,8,status,,
BK_Card_Shown,,8,tokenAllowedFlg,,
BK_Card_Shown,,8,ucid,,
BK_Card_Shown,,8,virtualFlg,,
BK_Card_Shown,,8,walletUserFlg,,
BK_Category_Set,"При показе экрана ""Категории""",1,category,,
BK_Category_Shown,"При показе экрана ""Категории""",1,category,,
BK_Fail_Pin_Shown,Переход на экран не успешной смены пина,1,pinFlg,,
BK_Issue_Block_Shown,,1,cardType,,
BK_Issue_Card_Set,"Нажатие на кнопку ""Заказать карту""",3,CardCount,,
BK_Issue_Card_Set,"Нажатие на кнопку ""Заказать карту""",3,Currency,,
BK_Issue_Card_Set,"Нажатие на кнопку ""Заказать карту""",3,Screen,,
BK_Issue_Cardtype_set,,1,cardType,,
BK_Issue_People_set,,1,personType,,
BK_Issue_Success_Shown,,2,cardType,,
BK_Issue_Success_Shown,,2,WalletAvailable,,
BK_MainPage_Cards,,1,CardsScreen,,
BK_MainPage_ShowCards,,3,CardCount,,
BK_MainPage_ShowCards,,3,Currency,,
BK_MainPage_ShowCards,,3,OpenFlg,,
BK_offer_virtual_card,,2,ButtonType,,
BK_offer_virtual_card,,2,WalletAvailable,,
BK_Pin_Offer_Shown,При показе оффера установки ПИНа,1,CardCount,,
BK_Spending_Preference_Shown,"При показе экрана ""Настроить траты""",5,cashLimit,,
BK_Spending_Preference_Shown,"При показе экрана ""Настроить траты""",5,cashLimitEnd,,
BK_Spending_Preference_Shown,"При показе экрана ""Настроить траты""",5,categorySelectedFlg,,
BK_Spending_Preference_Shown,"При показе экрана ""Настроить траты""",5,spendingLimit,,
BK_Spending_Preference_Shown,"При показе экрана ""Настроить траты""",5,spendingLimitEnd,,
Currency_Rate_Orders_Shown,При каждом успешном показе экрана Заявки на обмен валюты,1,ordersTab,активный таб,
Incoming_Transit_Confirm_Btn_Click,"При нажатии на кнопку ""Подтвердить"" в деталях платежа",0,,,
Incoming_Transit_Confirmation_Additional_Info,"При успешном показе экрана второго шага ""Дополнительная информация"" при подтверждении валютного платежа (Слать при каждом открытии, в том числе, если переходим на этот шаг с шага ""Контракт"")",0,,,
Incoming_Transit_Confirmation_Contract,"При успешном показе экрана шага ""Контракт"" при подтверждении валютного платежа (Слать при каждом открытии, в том числе, если переходим на этот шаг с шага ""Дополнительная информация"")",0,,,
Incoming_Transit_Contract_Btn_Click,При выборе контракта на экране Контракты,1,contractType,,
Incoming_Transit_Contract_Edit_Confirm_Shown,"При появлении pop-up ""Подтверждение о внесении изменений в контракт""",0,,,
Incoming_Transit_Contracts_Shown,При успешном показе экрана Контракты после нажатия на кнопку Выбрать/Создать контракт,0,,,
Incoming_Transit_Info_Shown,При показе экрана с деталями о валютном платеже,1,paymentStatus,,
Incoming_Transit_Sent,При успешной отправке валютного платежа,1,Confirmationtype,,
Incoming_Transit_Shown,При каждом успешном показе экрана На подтверждение.,0,,,
Payments_Incoming_Transit_Docs_Upload_Click,"При выборе источника файла (камера, галерея, файловый менеджер)",1,upload_type,,
Excerpt_Done,При успешном скачивании/просмотре/отправки выписки,4,extractGroup,выборка пользователя,
Excerpt_Done,При успешном скачивании/просмотре/отправки выписки,4,extractType,тип действия с выпиской,
Excerpt_Done,При успешном скачивании/просмотре/отправки выписки,4,operationsTypes,выбранные типы операций,
Excerpt_Done,При успешном скачивании/просмотре/отправки выписки,4,period,выбранный период,
Main_Shown,При показе Главной (в том числе после закрытия шторки с компаниями),0,,,
Search_INFO_Action,Слать событие если после ввода последнего символа прошло 3 секунды бездействия,1,enteredPhrase,введенная строка,
Search_MAIN_Shown,При открытии стартового экрана поиска,0,,,
Search_MOVE_Action,При переходе с экрана поиска в сервис,3,group,,
Search_MOVE_Action,При переходе с экрана поиска в сервис,3,service,название сервиса на который перешли,
Search_MOVE_Action,При переходе с экрана поиска в сервис,3,source,,
Deposit_Open_Shown,"Когда клиент зашел на страницу открытия депозита (где видит срок, ставку)",0,,,
Deposit_Refill_Confirm_Shown,Клиент нажал пополнить и попал на экран ввода смс,0,,,
Deposit_Refill_Sent,"Клиент успешно ввел смс при пополнении, от бэка получили ОК",0,,,
