Deposit_Refill_Shown,Клиент открыл экран пополнения депозита,0,,,
Limits_Changed,При успешном изменении лимитов,2,category,категория лимитов,
Limits_Changed,При успешном изменении лимитов,2,limitsType,тип лимитов,
More_Info_Item_Click,"При тапе на Банкоматы, Точки пополнения, Помощь бизнесу, Связь с банком, О приложении в Инфо",1,itemType,,
More_Services_Item_Click,"При тапе на пункты Tinkoff Бухгалтерия, Пригласи друга, Спецпредложения в Сервисах, Торговый Эквайринг, Обмен валют и т.п.",1,itemType,,
More_Settings_Item_Click,"При тапе на Вход и авторизация, Лимиты, Тарифы, Уведомления в Настройках",1,itemType,,
More_Shown,При каждом открытии экрана Еще (а также при выборе таба внутри экрана Еще) с параметром активного таба,1,activeTab,,
ClosingDocument_Create,После открытия формы создания ЗД,3,actionType,,
ClosingDocument_Create,После открытия формы создания ЗД,3,from,,
ClosingDocument_Create,После открытия формы создания ЗД,3,type,,
ClosingDocument_Shown,При открытии экрана Закрывающие документы,0,,,
ClosingDocument_Shown_List,Клиент зашел на вкладку в список ЗД,1,type,,
Emloyee_Create_Form,При открытии формы создания сотрудника (при редактировании не слать),1,creationType,,
Emloyee_Create_Send_Button,При успешной отправке анкеты сотрудника из формы создания сотрудника,0,,,
Employee_Button_Click,При тапе по кнопкам в любом виде сотрудника,2,buttonType,,
Employee_Button_Click,При тапе по кнопкам в любом виде сотрудника,2,employeeStatus,,
Employee_Shown,При заходе в конкретного сотрудника,2,bankType,,
Employee_Shown,При заходе в конкретного сотрудника,2,employeeStatus,,
Registry_Button_Click,При тапе по кнопкам в любом виде реестра,4,buttonType,,
Registry_Button_Click,При тапе по кнопкам в любом виде реестра,4,recipientType,,
Registry_Button_Click,При тапе по кнопкам в любом виде реестра,4,registerStatus,,
Registry_Button_Click,При тапе по кнопкам в любом виде реестра,4,registerType,,
Registry_Create_Form,При открытии формы создания реестра (при редактировании не слать),2,creationType,,
Registry_Create_Form,При открытии формы создания реестра (при редактировании не слать),2,recipientType,,
Registry_Create_Send_Button,При успешной отправке анкеты реестра из формы создания реестра,1,recipientType,,
Registry_Shown,При заходе в конкретный реестр,3,recipientType,,
Registry_Shown,При заходе в конкретный реестр,3,registerStatus,,
Registry_Shown,При заходе в конкретный реестр,3,registerType,,
Invoice_Delete,"При успешном удалении платежа (платежей, через мультивыбор). (Шлем со всех экранов: Входящие, Исходящие, Черновики)",1,cnt,,
Invoice_Details_Shown,При каждом показе экрана с деталями по инвойсу,3,detailsActiveTab,,
Invoice_Details_Shown,При каждом показе экрана с деталями по инвойсу,3,invoiceStatus,,
Invoice_Details_Shown,При каждом показе экрана с деталями по инвойсу,3,paymentStatus,,
Invoice_Done,При успешном выставлении счета,0,,,
Invoice_Incoming_Shown,При каждом успешном показе экрана Входящие счета,1,activeTab,,
Invoice_Outcoming_Marked_Payed,"При успешной отметке инвойса (или инвойсов, через мультивыбор) оплаченным",1,cnt,,
Invoice_Outcoming_Shown,При каждом успешном показе экрана Исходящие счета,1,activeTab,,
Invoice_Pay,При нажатии на Оплатить в деталях счета,0,,,
Notification_On,При первом включении любого способа уведомления для искусственного канала,0,,,
Synthetic_Channel_Shown,При показе экрана искусственного канала,0,,,
Counterpartry_Account_Req,При показе экрана реквизитов счета после нажатия на счет на экране со сведениями о контрагенте,0,,,
Counterparty_Action_Sheet_Shown,"При показе списка ""Платеж"" и ""Счет на оплату"" после нажатия на контрагента в топ-4",0,,,
Counterparty_All_Shown,"При показе экрана Контрагенты ""Все""",0,,,
Counterparty_Check_ArbitrationCases_Go_Down,Пролистывание экрана с судами до конца,1,scroll_available,Доступен ли скролл при открытии экрана,
Counterparty_Check_ArbitrationCases_Shown,Показ экрана с судебными делами в ПКА,1,source,"tab - если перешли по синей кнопке, button - если перешли по кнопке ""Все/Посмотреть все""",
Counterparty_Check_Contacts_Go_Down,Пролистывание экрана с контактами до конца в ПКА,1,scroll_available,Доступен ли скролл при открытии экрана,
Counterparty_Check_Contacts_Shown,Показ экрана с контактами в ПКА,1,source,"tab - если перешли по синей кнопке, button - если перешли по кнопке ""Все/Посмотреть все""",
Counterparty_Check_Counterparty_Error,При ошибке загрузки экрана с результатами проверки КА,2,inn,ИНН проверяемого контрагента,
Counterparty_Check_Counterparty_Error,При ошибке загрузки экрана с результатами проверки КА,2,reason,"источник ошибки: parsing - если ошибка парсинга, back - если ошибка бэка (""erroneous"": true)",
Counterparty_Check_Counterparty_Go_Down,Пролистывание экрана с результатами проверки КА до конца,1,scroll_available,Доступен ли скролл при открытии экрана,
Counterparty_Check_Counterparty_Shown,Показ экрана с результатами проверки КА,1,view,"full – полный вид (с кнопками ""Создать платеж, Выставить счет"", открывается из проверки контрагентов), short – шторка без кнопок ""Создать платеж, Выставить счет"", открывается из карточки контрагента, из платежной формы",
Counterparty_Check_Hint_Click,При клике на знак вопроса с подсказкой в ПКА,4,check_view,,
Counterparty_Check_Hint_Click,При клике на знак вопроса с подсказкой в ПКА,4,hint_type,"question – подсказка в знаке вопроса, full_screen – подсказка в шторке",
Counterparty_Check_Hint_Click,При клике на знак вопроса с подсказкой в ПКА,4,hintType,,
Counterparty_Check_Hint_Click,При клике на знак вопроса с подсказкой в ПКА,4,section,напротив какого поля нажата подсказка,
Counterparty_Check_Important_Go_Down,Пролистывание экрана с важной информацией до конца в ПКА,1,scroll_available,Доступен ли скролл при открытии экрана,
Counterparty_Check_Important_Shown,Показ экрана с важной информацией,1,source,"tab - если перешли по синей кнопке, button - если перешли по кнопке ""Все/Посмотреть все""",
Counterparty_Check_Main_Shown,Показ экрана Проверка контрагентов (с поиском),0,,,
Counterparty_Check_NewInvoice_Click,"При клике на ""Выставить счёт"" в проверке контрагента",0,,,
Counterparty_Check_NewPayment_Click,"При клике на ""Создать платеж"" в проверке контрагента",0,,,
Counterparty_Check_NotFound_Shown,Когда контрагент не найден в ПКА,0,,,
Counterparty_Check_OKVEDList_Go_Down,Пролистывание экрана с видами деятельности до конца в ПКА,1,scroll_available,Доступен ли скролл при открытии экрана,
Counterparty_Check_OKVEDList_Shown,Показ экрана с видами деятельности,1,source,"tab - если перешли по синей кнопке, button - если перешли по кнопке ""Все/Посмотреть все""",
Counterparty_Check_Requsites_Go_Down,Пролистывание экрана с реквизитами до конца в ПКА,1,scroll_available,Доступен ли скролл при открытии экрана,
Counterparty_Check_Requsites_LeaderList_Go_Down,Пролистывание экрана с руководителями до концав ПКА,1,scroll_available,Доступен ли скролл при открытии экрана,
Counterparty_Check_Requsites_LeaderList_Shown,Показ шторки с руководителями в ПКА,0,,,
Counterparty_Check_Requsites_Shown,Показ экрана с реквизитами в ПКА,1,source,"source: tab - если перешли по синей кнопке, button - если перешли по кнопке ""Все/Посмотреть все""",
Counterparty_Check_Search_Change,Поисковые запросы в ПКА,2,enteredPhrase,,
Counterparty_Check_Search_Change,Поисковые запросы в ПКА,2,query,,
Counterparty_Check_Search_Error,При ошибке загрузки экрана с результатами проверки КА,0,,,
Counterparty_Details_Account_Click,Клик/тап на счёт в острове со счетами в карточке контрагента,0,,,
Counterparty_Details_Account_Shown,Показ экрана со счётом контрагента в карточке контрагента,1,main,,
Counterparty_Details_Check_Error,"Ошибка загрузки проверки контрагента на экране ""Карточка контрагента""",0,,,
Counterparty_Details_Contact_Click,Клик на контакт в острове с контактами в карточке контрагента,0,,,
Counterparty_Details_Contact_Shown,Показ экрана с контактом контрагента в карточке контрагента,0,,,
Counterparty_Details_Go_Down,Скролл карточки контрагента вниз до конца,1,scroll_available,Доступен ли скролл при открытии экрана,
Counterparty_Details_Invoice_Create,"Клик на кнопку ""Выставить счет"" в карточке контрагента",1,source,"где нажата кнопка: 
details_main – из карточки контрагента (из шапки)
account – с экрана счёта",
Counterparty_Details_Island_Click,"Клик на ""Посмотреть все""/""Все"" на одном из островов в сводке на карточке контрагента",1,island,"operations – остров с операциями (только веб)
express_check – остров Экспресс проверка 
requisites – остров Реквизиты
okveds – остров Виды деятельности
contact_data – остров Контактные данные
accounts – остров Счета
contacts – остров Контакты",
Counterparty_Details_Mark_Favourite,Клик на звезду – добавление контрагента в избранные,1,action,"add – добавил в избранные
delete – удалил из избранных",
Counterparty_Details_Payment_Create,"Клик на кнопку ""Создать платеж"" в карточке контрагента",1,source,"details_main – из карточки контрагента (из шапки)
account – с экрана счёта",
Counterparty_Details_PhoneOrMail_Click,Клик на телефон или почту контакта контрагента на экране с контактом контрагента в карточке контрагента,1,field,"На какое поле нажали:
phone - телефон
email - почта",
Counterparty_Details_Shown,"Показ экрана ""Карточка контрагента""",0,,,
Counterparty_Favourite_Shown,При показе экрана со списком своих избранных контрагентов,0,,,
Counterparty_Info_Shown,"Старая карточка контрагента (При показе экрана со сведениями о контрагенте при выборе контрагента с экрана ""Контрагенты"" (как со вкладки ""избранные"", так и со вкладки ""все""))",0,,,
Counterparty_Main_Error,При ошибке загрузки экрана с разделом Контрагенты,0,,,
Counterparty_Main_Shown,При показе экрана с разделом Контрагенты,0,,,
Counterparty_MyCounterparties_Shown,При показе экрана Мои контрагенты,0,,,
Company_Change_Done,При успешной смене компании,0,,,
Company_Change_Shown,,0,,,
Main_Company_Change,При тапе на кнопку смены Компании,0,,,
Sms_Resend_Tap,нажали «Отправить еще раз»,0,,,
Tinkoff_Business_Background_Enter,Слать каждый раз при сворачивании приложения,0,,,
Tinkoff_Business_Foreground_Enter,Слать каждый раз при разворачивании приложения,0,,,
New_Product_Account_Done,При успешной подаче заявки на открытие новых счетов,1,currency,,
New_Product_Application_Done,При успешной подаче заявки на новый продукт,1,applProduct,,
New_Product_Shown,При показе экрана Новый продукт,1,from,,
New_Product_Shown_Account_Currency,При показе экрана Валюта счета,0,,,
Overnight_Offer_Out,При закрытии оффера Овернайтов,2,offerNo,,
Overnight_Offer_Out,При закрытии оффера Овернайтов,2,offerVar,,
Overnight_Offer_Shown,При показе оффера Овернайтов после выбора клиентом этого продукта,3,offerNo,,
Overnight_Offer_Shown,При показе оффера Овернайтов после выбора клиентом этого продукта,3,offerVar,,
Overnight_Offer_Shown,При показе оффера Овернайтов после выбора клиентом этого продукта,3,way,,
Overnight_Replenishment_Success,При успешном пополнении овернайта,0,,,
Draft_Saved,"сохранили черновик платежа

заблокировано в Amplitude с 9.07.2018. Автоматическое сохранение происходит 8 раз за платежку и сильно жрет лимит",2,action,"save (нажали кнопку сохранить), form (закрыли форму), auto (оно само сохранилось)",
Draft_Saved,"сохранили черновик платежа

заблокировано в Amplitude с 9.07.2018. Автоматическое сохранение происходит 8 раз за платежку и сильно жрет лимит",2,payment_id,id операции,
Payment_Change_After_QR_Scan,При изменении какого-либо поля на форме платежа после сканирования QR,3,aim,тип изменения,
Payment_Change_After_QR_Scan,При изменении какого-либо поля на форме платежа после сканирования QR,3,fieldType,тип поля,
Payment_Change_After_QR_Scan,При изменении какого-либо поля на форме платежа после сканирования QR,3,paymentType,тип платежа,
Payment_Create_Shown,При открытии формы создания платежа. (При заходе на форму),2,aim,действие над платежом,
Payment_Create_Shown,При открытии формы создания платежа. (При заходе на форму),2,provider,провайдер платежа,
Payment_Details_Shown,При показе экрана с деталями по платежу.,3,from,,
Payment_Details_Shown,При показе экрана с деталями по платежу.,3,paymentStatus,,
Payment_Details_Shown,При показе экрана с деталями по платежу.,3,provider,провайдер платежа,
Payment_Sent,"При успешной отправке платежа (кривое событие, баги ищи в справочнике)",2,cnt,,
Payment_Sent,"При успешной отправке платежа (кривое событие, баги ищи в справочнике)",2,provider,,
Payments_Shown,"экран Платежи, генерируем на каждом табе",1,tab,"create (на андроид это экран нового плОтижа), drafts, toSign, queue",
QR_Scanned,При успешном скане QR-кода,2,paymentType,тип платежа,
QR_Scanned,При успешном скане QR-кода,2,QR_ID_Invoice,,
QR_Scanner_Error,При вылетании попапа об ошибке сканирования,0,,,
QR_Scanner_Shown,При открытии экрана для скана QR-кода,1,from,,
Payment_Photo_Change_After_Recognition,При изменении какого-либо поля на форме платежа.,2,paymentType,,
Payment_Photo_Change_After_Recognition,При изменении какого-либо поля на форме платежа.,2,photoFieldType,,
Payment_Photo_Error,При вылетании попапа об ошибке распознавания,1,paymentType,,
Payment_Photo_Highlighted_Fields_After_Recognition,"После распознавания платежа по фото. Шлем как флаг для каждого поля, в котором сервис не уверен и подсвечивает его. Для каждого поля - отдельное событие!",2,paymentType,,
Payment_Photo_Highlighted_Fields_After_Recognition,"После распознавания платежа по фото. Шлем как флаг для каждого поля, в котором сервис не уверен и подсвечивает его. Для каждого поля - отдельное событие!",2,photoFieldType,,
Payment_Photo_Shown,"При открытии экрана с камерой после нажатия кнопки ""Платеж по фото""",1,paymentType,,
Payment_Photo_Success,"При успешной обработке изображения, если делается платеж по фото.",1,paymentType,,
Aggregate_Go_Down,Репутация. При пролистывании экрана конкретного агрегата до конца,2,agrType,,
Aggregate_Go_Down,Репутация. При пролистывании экрана конкретного агрегата до конца,2,problemFlg,,
Aggregate_Shown,Репутация. При открытии экрана конкретного агрегата,3,agrType,,
Aggregate_Shown,Репутация. При открытии экрана конкретного агрегата,3,problemFlf,,
Aggregate_Shown,Репутация. При открытии экрана конкретного агрегата,3,problemFlg,,
Dislike_Situation_Click,Репутация. При нажатии на Dislike в ситуации,2,agrType,,
Dislike_Situation_Click,Репутация. При нажатии на Dislike в ситуации,2,sitType,,
Like_Situation_Click,Репутация. При нажатии на Like в ситуации,2,agrType,,
Like_Situation_Click,Репутация. При нажатии на Like в ситуации,2,sitType,,
Rep_Info,При нажатии на Инфо,0,,,
Rep_Info_Go_Down,При пролистывании странички Инфо до конца,0,,,
Rep_Profile_Initialization,"При тапе на плашку ""анкета"" на основном экране сервиса ""Репутация""",2,percent,,
Rep_Profile_Initialization,"При тапе на плашку ""анкета"" на основном экране сервиса ""Репутация""",2,status,,
Rep_Question_Answer,При уходе с экрана вопроса. Слать только если ответ заполнен,4,answerType,,
Rep_Question_Answer,При уходе с экрана вопроса. Слать только если ответ заполнен,4,questNumber,,
Rep_Question_Answer,При уходе с экрана вопроса. Слать только если ответ заполнен,4,questType,,
Rep_Question_Answer,При уходе с экрана вопроса. Слать только если ответ заполнен,4,questWeight,,
Rep_Question_Shown,При показе экрана с вопросом,4,prefillFlg,,
Rep_Question_Shown,При показе экрана с вопросом,4,questNumber,,
Rep_Question_Shown,При показе экрана с вопросом,4,questType,,
Rep_Question_Shown,При показе экрана с вопросом,4,questWeight,,
Reputation_Go_Down,При пролистывании странички вниз до конца,0,,,
Reputation_Shown,При заходе на страницу Репутации,0,,,
Situation_Link,Репутация. При нажатии на ссылку внутри конкретной ситуации,4,agrType,,
Situation_Link,Репутация. При нажатии на ссылку внутри конкретной ситуации,4,linkType,,
Situation_Link,Репутация. При нажатии на ссылку внутри конкретной ситуации,4,problemFlg,,
Situation_Link,Репутация. При нажатии на ссылку внутри конкретной ситуации,4,sitType,,
Situation_Shown,При разворачивании конкретной ситуации в агрегате,2,agrType,,
Situation_Shown,При разворачивании конкретной ситуации в агрегате,2,sitType,,
Documents_To_Sign_Shown,При каждом успешном показе экрана Документы на подпись,1,documents,,
Drafts_Shown,При каждом успешном показе экрана Черновики,1,draftsActiveTab,,
Events_Shown,"При тапе на раздел События, отправлять каждый раз при заходе на этот раздел",0,,,
Payment_Delete,При успешном удалении платежа с экрана Черновиков,2,cnt,,
Payment_Delete,При успешном удалении платежа с экрана Черновиков,2,provider,,
Payment_Revoke,При успешном отзыве платежа,3,cnt,,
Payment_Revoke,При успешном отзыве платежа,3,deletedFlg,,
Payment_Revoke,При успешном отзыве платежа,3,provider,,
Payments_Declined_Shown,При каждом успешном показе экрана Отклоненные,0,,,
Payments_Search_Click,При тапе на поиск (в тулбаре или ленте платежей),1,fromScreen,,
Payments_Submitted_Shown,При каждом успешном показе экрана Очередь оплаты.,0,,,
Payments_To_Sign_Shown,При каждом успешном показе экрана На подпись,0,,,
Create_Shown,При показе экрана Создать. Слать при каждом появлении на дисплее телефона,0,,,
